{
  "type": "theme",
  "name": "WP Skill Block Basic",
  "textDomain": "wp-skill-block-basic",
  "themeType": "block",
  "requiredFiles": ["style.css", "functions.php", "theme.json"],
  "templates": ["templates/index.html"],
  "parts": ["parts/header.html", "parts/footer.html"],
  "patterns": ["patterns/hero.php"],
  "themeJson": {
    "schema": "https://schemas.wp.org/wp/6.5/theme.json",
    "version": 3
  },
  "boundaries": {
    "businessLogicInPlugin": true,
    "presentationInTheme": true
  }
}
